col0,col1,col2,col3
Embroidered Tondo from an Altar Frontal: The Coronation of the Virgin,public domain,religious art,or nué
"Fragmentary Icon Panel, Christ in Glory",public domain,Christian art,dovetailing
Icon of the Virgin and Child,public domain,Christian art,dovetailing
"Fragmentary Icon Panel, Christ in Glory",public domain,Christian art,slit tapestry weaving
Icon of the Virgin and Child,public domain,Christian art,slit tapestry weaving
Hanging with Christian Images,public domain,Christian art,plain weave
