col0,col1,col2,col3,col4
Verdure with birds,tapestry weaving,fragment,silk,Château d'Angers
Episode from Roman History: Aemilius Paullus Becomes Consul for the Second Time,tapestry weaving,fragment,silk,Château du Plessis-Macé
A Stop on the Journey,tapestry weaving,fragment,textile,Hôtel de Rochechouart
Tapestry fragments on a green ground,textile painting,fragment,wool,Hospices de Beaune
Tapestry fragments on a red ground,textile painting,fragment,wool,Hospices de Beaune
"Tapestry fragment ""Quand Dieu vouldra""",tapestry weaving,fragment,silk,M-Museum Leuven
