col0,col1,col2,col3,col4,col5,col6
2018 Magnitogorsk building collapse,Magnitogorsk Urban Okrug,explosion,Russia,2018-12-31,17,Magnitogorsk
2017 Port Authority Bus Terminal explosion,New York City,explosion,United States of America,2017-12-11,4,Times Square–42nd Street/Port Authority Bus Terminal
2016 New York and New Jersey bombings,Elizabeth,explosion,United States of America,2016-09-17,29,Chelsea
Békásmegyer Explosion,Óbuda-Békásmegyer,explosion,Hungary,1993-09-14,10,Békásmegyer
2020 Tarragona explosion,La Canonja,conflagration,Spain,2020-01-14,7,Complex Petroquímic de Tarragona
