col0,col1,col2,col3
Roman Catholic Ecclesiastical Province of Tyre,Lebanon,ecclesiastical province,Melkite Catholic Archeparchy of Tyre
Roman Catholic Ecclesiastical Province of Kirkuk,Iraq,ecclesiastical province,Chaldean Catholic Archeparchy of Kirkuk
Ecclesiastical Province of Bangkok,Thailand,ecclesiastical province,Roman Catholic Diocese of Chanthaburi
Ecclesiastical province of Košice,Slovakia,ecclesiastical province,Roman Catholic Archdiocese of Košice
Ecclesiastical province of Olomouc,Czech Republic,ecclesiastical province,Roman Catholic Diocese of Brno
Ecclesiastical province of Pamplona and Tudela,Spain,ecclesiastical province,Roman Catholic Diocese of Jaca
