col0,col1,col2,col3
Supernatural,Shaman,Favorite Pop/Rock Album,Compact Disc
All the Right Reasons,Dark Horse,Favorite Pop/Rock Album,Compact Disc
The Boys,Girls' Generation II: Girls & Peace,Mnet Asian Music Award for Album of the Year,Compact Disc
All the Right Reasons,Dark Horse,Juno Award for Rock Album of the Year,Compact Disc
It Takes a Nation of Millions to Hold Us Back,Fear of a Black Planet,Soul Train Music Award for Best Rap Album,gramophone record
AmeriKKKa's Most Wanted,Death Certificate,Soul Train Music Award for Best Rap Album,Compact Disc
Gangsta's Paradise,My Soul,Soul Train Music Award for Best Rap Album,Compact Disc
