col0,col1,col2,col3,col4
"Ewa Ciszewska, Konrad Klejsa",book review,2016-04-30,English,"Ewa Ciszewska, Konrad Klejsa (eds.):  Kultura filmowa współczesnej Łodzi"
The South Australian State Elections 1973,non-fiction,1973-12-01,English,The South Australian State Elections 1973
"A Functional ""Gerrymander""",non-fiction,1970-12-01,English,"A Functional ""Gerrymander"""
A gateway to Creating an Inclusive Learning Environment,pedagogy,2014-01-01,English,A gateway to Creating an Inclusive Learning Environment
The Subject and Power,essay,1982-07-01,English,The Subject and Power
