col0,col1,col2,col3,col4,col5
World Tour of the Century,Once Upon a Tour,2003-09-27,59,concert tour,Nightwish
Rock the Nation Tour,Rising Sun Tour,2004-08-17,59,concert tour,KISS
The Rolling Stones British Tour 1963,The Rolling Stones 1st British Tour 1964,1963-11-03,60,concert tour,The Rolling Stones
California Dreams Tour,Prismatic World Tour,2012-01-22,61,concert tour,Katy Perry
Confessions Tour,Sticky & Sweet Tour,2006-09-21,60,concert tour,Madonna
A Day at the Races Tour,News of the World Tour,1977-06-07,60,concert tour,Queen
...Baby One More Time Tour,Oops!... I Did It Again World Tour,1999-09-15,56,concert tour,Britney Spears
Close Encounters Tour,Take the Crown Stadium Tour,2006-12-18,57,concert tour,Robbie Williams
