col0,col1,col2,col3,col4,col5,col6
Brno,"Základní škola, Brno, Bosonožská 9, příspěvková organizace",municipality of the Czech Republic,UTC+01:00,230.182739,Obec přátelská rodině,Brockhaus and Efron Encyclopedic Dictionary
Plzeň,78. mateřská škola,statutory city,UTC+02:00,137.671042,European Capital of Culture,Brockhaus and Efron Encyclopedic Dictionary
Brno,"Základní škola a Mateřská škola Brno, Milénova 14, příspěvková organizace",statutory city,UTC+01:00,230.182739,Obec přátelská rodině,Brockhaus and Efron Encyclopedic Dictionary
Plzeň,78. mateřská škola,statutory city,UTC+01:00,137.671042,European Capital of Culture,Brockhaus and Efron Encyclopedic Dictionary
Brno,"Základní škola Brno, nám. Svornosti 7, příspěvková organizace",municipality with authorized municipal office,UTC+02:00,230.182739,Obec přátelská rodině,Brockhaus and Efron Encyclopedic Dictionary
Třebíč,Centrální školní jídelna,municipality with town privileges in the Czech Republic,UTC+02:00,57.591176,Obec přátelská rodině,Ottův slovník naučný
