col0,col1,col2,col3
Barbie in A Mermaid Tale 2,Category I,Universal Studios Home Entertainment,Barbie: The Princess and the Popstar
Tom and Jerry: Back to Oz,Category II,Warner Home Video,Tom and Jerry: Willy Wonka and the Chocolate Factory
Justice League vs. Teen Titans,Category III,Warner Home Video,Teen Titans: The Judas Contract
Tom and Jerry: The Lost Dragon,Category II,Warner Home Video,Tom and Jerry: Spy Quest
Tom and Jerry's Giant Adventure,Category II,Warner Home Video,Tom and Jerry: The Lost Dragon
