col0,col1,col2,col3,col4,col5
2005 World Rowing Junior Championships – Junior women's coxless pair,junior women's coxless pair,rowing,2006 World Rowing Junior Championships – Junior women's coxless pair,2005-01-01,2000
2005 World Rowing Junior Championships – Junior women's quad scull,junior women's quad scull,rowing,2006 World Rowing Junior Championships – Junior women's quad scull,2005-01-01,2000
2005 World Rowing Junior Championships – Junior women's double scull,junior women's double scull,rowing,2006 World Rowing Junior Championships – Junior women's double scull,2005-01-01,2000
2005 World Rowing Junior Championships – Junior women's single scull,junior women's single scull,rowing,2006 World Rowing Junior Championships – Junior women's single scull,2005-01-01,2000
2004 World Rowing Junior Championships – Junior men's eight,junior men's eight,rowing,2005 World Rowing Junior Championships – Junior men's eight,2004-01-01,2000
