col0,col1,col2,col3
Vesta Accumulator Company Building,2100 South Indiana Avenue,place listed on the National Register of Historic Places,United States of America
Home Ice Company,700 Cate Avenue,place listed on the National Register of Historic Places,United States of America
Evans Manufacturing Company Building,301 6th Avenue SE,place listed on the National Register of Historic Places,United States of America
FPU Factory/Advocate Building,Main Street,municipal heritage site,Canada
Chalk Works,46 Cavan Street,designated heritage property (part IV),Canada
17 Queen Street,17 Queen Street (Campbellford),designated heritage property (part IV),Canada
Meyer's Mill,54 Station Street,designated heritage property (part IV),Canada
