col0,col1,col2,col3,col4
Swan River Provincial Park,Canada,2.23,provincial park of Manitoba,Municipality of Swan Valley West
Margaret Bruce Provincial Park,Canada,6.05,provincial park of Manitoba,Alonsa
Marchand Provincial Park,Canada,1.78,provincial park of Manitoba,Rural Municipality of Reynolds
Oak Lake Provincial Park,Canada,11.4,provincial park of Manitoba,Rural Municipality of Sifton
Manipogo Provincial Park,Canada,60.69,provincial park of Manitoba,Manitoba
Grand Valley Provincial Park,Canada,26.19,provincial park of Manitoba,Manitoba
Grand Rapids Provincial Park,Canada,7.358,provincial park of Manitoba,Manitoba
