col0,col1,col2,col3,col4
Titanic,Golden Globe Award for Best Motion Picture – Drama,For ages 11 and up,Category II,free from 10 years
Thor,Saturn Award for Best Costume,For ages 11 and up,Category II,free from 10 years
Titanic,National Film Registry,For ages 11 and up,Category II,free from 10 years
The Last Airbender,Golden Raspberry Award for Worst Supporting Actor,For ages 11 and up,Category II,free from 10 years
Harry Potter and the Order of the Phoenix,European Film Award – People's Choice Award for Best European Film,For ages 11 and up,Category II,free from 10 years
