col0,col1,col2,col3,col4,col5
Bonaventure Island and Percé Rock Migratory Bird Sanctuary,Canada,1919-03-29,Percé,migratory bird sanctuary of Canada,IUCN category III: Natural Monument or Feature
Bird Rocks Migratory Bird Sanctuary,Canada,1919-03-29,Grosse-Île,migratory bird sanctuary of Canada,IUCN category Ia: Strict Nature Reserve
Great Australian Bight Marine National Park,Australia,1996-09-26,South Australia,marine protected area,IUCN category II: National Park
Terra Nova Migratory Bird Sanctuary,Canada,1967-01-01,Newfoundland and Labrador,marine protected area,IUCN category II: National Park
Great Australian Bight Commonwealth Marine Reserve,Australia,2012-01-01,South Australia,marine protected area,IUCN category II: National Park
National Natural Reserve of Saint Barthélemy,France,1996-01-01,Saint Barthélemy,marine protected area,IUCN category IV: Habitat/Species Management Area
National Natural Reserve of Saint Martin,France,1998-01-01,Saint Martin,marine protected area,IUCN category IV: Habitat/Species Management Area
Bonaventure Island and Percé Rock Migratory Bird Sanctuary,Canada,1919-03-29,Percé,marine protected area,IUCN category III: Natural Monument or Feature
