col0,col1,col2,col3
Church of Our Lady the Merciful,Axion Estin,Vasily Kosyakov,cultural heritage site in Russia
Chesme Church,John the Baptist,Yury Felten,cultural heritage site in Russia
St. Mark's Church,Mark the Evangelist,Petar and Branko Krstić,protected cultural monument in Serbia
Turku Orthodox Church,Saint Alexandra,Carl Ludvig Engel,protected by the Law of the Orthodox Church in Finland
Holy Trinity Cathedral,Trinity,Louis Sullivan,place listed on the National Register of Historic Places
Cathedral of the Dormition,Dormition of the Theotokos,Yakov Bukhvostov,cultural heritage site in Russia
