col0,col1,col2,col3,col4,col5
First Epistle to the Thessalonians,religious text,epistle,Paul,1 Thessalonians 1,New Testament
Second Epistle to the Thessalonians,religious text,epistle,Paul,2 Thessalonians 1,New Testament
Epistle of James,book of the Bible,epistle,James the Just,James 3,New Testament
Epistle to the Colossians,book of the Bible,epistle,Paul,Colossians 2,New Testament
Epistle to the Galatians,literary work,epistle,Paul,Galatians 1,New Testament
Epistle of James,religious text,epistle,James the Just,James 3,New Testament
Epistle to the Colossians,religious text,epistle,Paul,Colossians 2,New Testament
First Epistle of Peter,epistle,epistle,Peter,1 Peter 2,New Testament
