col0,col1,col2,col3,col4
Keesler U.S. Air Force Base Outdoor Theater,"Keesler Air Force Base, Biloxi, MS 39524",United States of America,outdoor cinema,Biloxi
Open-Air Cinema,"Gaze Road, Flying Fish Cove",Australia,outdoor cinema,Flying Fish Cove
Christmas Island Outdoor Cinema,"Poon Saan Road, Drumsite",Australia,outdoor cinema,Drumsite
Sun Picture Gardens,"8 Carnarvon St, Broome",Australia,outdoor cinema,Western Australia
Grove Open Air Theatre,"62 Belmore Street, Yarrawonga VIC 3730",Australia,movie theater,Yarrawonga
Moonlight Cinema Adelaide,"Plane Tree Drive, Adelaide SA 5000",Australia,movie theater,Adelaide
Wundowie Oval,"Boronia Avenue and Banksia Avenue, Wundowie WA 6560",Australia,movie theater,Wundowie
