col0,col1,col2,col3,col4,col5,col6
Durning Library,Gothic Revival architecture,Grade II listed building,Lambeth London Borough Council,London Borough of Lambeth,6.220377,"Durning Library, 167 Kennington Lane, London, SE11 4HF"
Purley Library,Modern Movement,Grade II listed building,Croydon London Borough Council,London Borough of Croydon,69.13058,"Purley Library, Banstead Road, Purley, Croydon, CR8 3YH"
Bristol Central Library,Tudor Revival architecture,Grade I listed building,Bristol City Council,City of Bristol,19.48371,"Bristol Central Library, College Green, Bristol, BS1 5TL"
Manchester Central Library,Neoclassical architecture,Grade II* listed building or structure,Manchester City Council,Manchester,55.98585,"Manchester Central Library, St Peters Square, City Centre, M2 5PD"
Barrow-in-Furness Main Public Library,Beaux-Arts,Grade II listed building,Cumbria County Council,Barrow-in-Furness,12,"Barrow Library, Ramsden Square, Barrow-in-Furness, LA14 1LL"
Derby Central Library,Gothic Revival architecture,Grade II listed building,Derby City Council,Derby,49.00128,"Derby Central Library, The Wardwick, Derby, DE1 1HS"
