col0,col1,col2,col3,col4
Hans Rosling: New insights on poverty,Hans Rosling,2007-06-25,poverty,TED conferences
Edward Snowden: Here's how we take back the Internet,Edward Snowden,2014-03-19,Internet,TED conferences
Bono: My wish: Three actions for Africa,Bono,2006-10-31,Africa,TED conferences
Richard Ledgett: The NSA responds to Edward Snowden’s TED Talk,Richard Ledgett,2014-03-21,Edward Snowden: Here's how we take back the Internet,TED conferences
Hillel Cooperman: Legos for grownups,Hillel Cooperman,2010-06-25,Lego,TED conferences
