col0,col1,col2,col3
Statue of Zeus at Olympia,Greece,Wonder of the Ancient World,-0436-01-01T00:00:00Z
Athena Parthenos,Greece,lost sculpture,-0447-01-01T00:00:00Z
Athena Promachos,Greece,lost sculpture,-0456-01-01T00:00:00Z
Statue of Zeus at Olympia,Greece,lost sculpture,-0436-01-01T00:00:00Z
Colossus of Constantine,Italy,destroyed artwork,0312-01-01
Statue of Zeus at Olympia,Greece,destroyed artwork,-0436-01-01T00:00:00Z
Mao Zedong Statue,People's Republic of China,statue of Mao Zedong,1968-01-01
The Motherland Calls,Russia,cultural heritage site in Russia,1959-01-01
Worker and Kolkhoz Woman,Russia,cultural heritage site in Russia,1937-01-01
