col0,col1,col2,col3
Planta da Villa 7 de Setembro,1921-07-01,J. Oct. Monteiro Camargo,Ipiranga
Planta da Avenida Nazareth e Outras Ruas nos Terrenos de Propriedade do Dr. José Vicente de Azevedo Sitos Na Collina e Arrabalde do Ypiranga...,1918-05-18,J. Krichbaum,Ipiranga
Planta da Chácara Denominada Bella Veneza,1894-03-17,José Feliciano Ferreira de Rosa,Pinheiros District
Planta dos Sitios Juboassava e Boassava Bairro,1929-06-20,José Ayrosa Galvão Junior,Lapa District
Planta do Terreno Aquem do Rio Tamanduatehi Levantado Por Ordem da Camara,1924-08-27,A. Alexandrino,Tamanduateí River
Planta da Villa 7 de Setembro,1921-07-01,J. Oct. Monteiro Camargo,Ipiranga District
Planta de Divisão do Terreno Pertencente a Herdeiros do Finado João de Abreu Nogueira,1891-09-14,Oscar Friedenreich,Cotia
