col0,col1,col2,col3,col4,col5
"Dreamland, Part 3",1995-01-01,"Dreamland, Part 4",New York City,"Dreamland, Part 2",United States of America
"Dreamland, Part 2",1994-12-01,"Dreamland, Part 3",New York City,"Dreamland, Part 1",United States of America
The Eyes of Sarnath,1993-08-01,Out of the Blue (Into the Black),Japan,Fox Hunt,United States of America
Mutations,1993-06-01,Fox Hunt,New York City,"Here Today, Gone Tomorrow",United States of America
"Here Today, Gone Tomorrow",1993-05-01,Mutations,New York City,Past Lives,United States of America
Future Tense,1993-03-01,Past Lives,New York City,And Deliver Us from Evil,United States of America
The Karma of Katmandu,1992-06-01,The Search for the Charlie Llama,Japan,"The Good, the Bad and the Tattooed",United States of America
"The Good, the Bad and the Tattooed",1992-05-01,The Karma of Katmandu,Kyoto,Turning Japanese,United States of America
