col0,col1,col2,col3,col4,col5
Reprodução de Planta: Villa Imperio Propriedade de José Torini,33,paper,GLAM Museu Paulista,copying,Museu Paulista
Sitio de Propriedade de Paulino Antonio dos Santos Municipio de São Paulo Sub-Prefeitura de Santo Amaro Bairro da Varginha,30,paper,GLAM Museu Paulista,copying,Museu Paulista
Reprodução de Planta: Planta dos Terrenos de Propriedade de João Raymundo de Oliveira,30.5,paper,GLAM Museu Paulista,copying,Museu Paulista
Parte da Planta do Sitio Denominado Fazenda Na Estrada Velha Ou do Coursino Freguezia a Sé a S. Bernardo,23.8,paper,GLAM Museu Paulista,copying,Museu Paulista
Reprodução de Planta: Planta do Lote de 35 Alqrs. Procedente do Dr. Pimenta Assessor Cel. Galeano Alfredo de Almeida,38.8,paper,GLAM Museu Paulista,copying,Museu Paulista
Reprodução de Planta: Mirandopolis Saude,31.9,photocopy,GLAM Museu Paulista,copying,Museu Paulista
