col0,col1,col2,col3,col4
La Provincia di Varese,2017-01-01,daily newspaper,Italy,Berliner
The Toronto Evening Telegram,1971-01-01,daily newspaper,Canada,broadsheet
L'Italia del popolo,1848-08-03,daily newspaper,Kingdom of Lombardy–Venetia,broadsheet
New York Journal-American,1966-01-01,daily newspaper,United States of America,broadsheet
Rocky Mountain News,2009-02-27,daily newspaper,United States of America,tabloid
La Nación,2010-12-19,daily newspaper,Chile,tabloid
The Miami News,1988-12-31,daily newspaper,United States of America,broadsheet
Magyar Nemzet,2018-04-11,daily newspaper,Hungary,broadsheet
