col0,col1,col2,col3
New Addictions,Sometime Last Night,2017-01-01,United States of America
Limitless,NCT 127,2017-01-06,South Korea
Mist sä tuut EP,247365,2016-12-16,Finland
Spring,Dreaming,2016-04-27,South Korea
Eventide,Thylacine,1998-08-01,Australia
The Lord of Steel Live,Thunder in the Sky,2013-01-01,United States of America
The Bombsessions EP,Dead End Street,2005-01-01,Norway
"The Most Beautiful Moment In Life, Part 1",Dark & Wild,2015-04-29,South Korea
Songs From the Laundry Room,iTunes Festival: London 2011,2015-04-18,United States of America
Meanwhile in Burbank,House of Gold & Bones Part 2,2015-04-18,United States of America
