col0,col1,col2,col3,col4
Lauadèr de Bossòst,lavoir,Bossòst,Spain,Cultural Asset of Local Interest
Lauder de Vilamòs,lavoir,Vilamòs,Spain,Cultural Asset of Local Interest
Safareig de Jorba,lavoir,Jorba,Spain,Cultural Asset part of the architectural heritage of Catalonia
L-Għajn il-Kbira,lavoir,Fontana,Malta,Grade 1
Safareig de Cal Ròmul Torrents,lavoir,Sant Pere de Riudebitlles,Spain,Cultural Asset part of the architectural heritage of Catalonia
Wash House,lavoir,Angus,United Kingdom,category B listed building
Lavoir de Lauris,lavoir,Lauris,France,registered historic monument
Fontaine-lavoir de Montagney,lavoir,Montagney,France,registered historic monument
