col0,col1,col2,col3,col4,col5,col6
A Romance of the Redwoods,Famous Players-Lasky Corporation,70,United States of America,drama film,silent film,public domain
The Oyster Princess,PAGU,60,Germany,comedy film,silent film,public domain
The Hunchback of Notre Dame,Universal Studios,133,United States of America,drama film,silent film,public domain
Blind Husbands,Universal Studios,93,United States of America,drama film,silent film,public domain
The Last Laugh,Universum Film AG,101,Germany,drama film,silent film,public domain
Orphans of the Storm,United Artists Corporation,150,United States of America,drama film,silent film,public domain
