col0,col1,col2,col3,col4
Berlin,Landesarchiv Berlin,Los Angeles,Brandenburg,Sytin Military Encyclopedia
Cologne,Historical Archive of the City of Cologne,Rio de Janeiro,Hürth,Jewish Encyclopedia of Brockhaus and Efron
Berlin,Landesarchiv Berlin,Mexico City,Havelland District,Small Brockhaus and Efron Encyclopedic Dictionary
Cologne,Historical Archive of the City of Cologne,Rotterdam,Leverkusen,Sytin Military Encyclopedia
Brunswick,Stadtarchiv Braunschweig,Kiryat Tiv'on,Wolfenbüttel,The Nuttall Encyclopædia
