col0,col1,col2,col3,col4,col5
Clinical Cancer Research,Clinical Cancer Research,American Association for Cancer Research,Keith Flaherty,cancer,1995-01-01
Annals of Internal Medicine,Annals of Internal Medicine,American College of Physicians,Christine Laine,medicine,1927-01-01
Proceedings of the National Academy of Sciences of the United States of America,Proceedings of the National Academy of Sciences of the United States of America,National Academy of Sciences,May Berenbaum,medicine,1915-01-01
The New England Journal of Medicine,The New England Journal of Medicine,Massachusetts Medical Society,Jeffrey M. Drazen,medicine,1812-01-01
Proceedings of the National Academy of Sciences of the United States of America,Proceedings of the National Academy of Sciences of the United States of America,National Academy of Sciences,May Berenbaum,engineering,1915-01-01
Journal of General Virology,Journal of General Virology,Microbiology Society,Geoffrey Lilley Smith,virology,1967-01-01
ACS Chemical Biology,ACS Chemical Biology,American Chemical Society,Laura Lee Kiessling,molecular biology,2006-01-01
Journal of Bacteriology,Journal of Bacteriology,American Society for Microbiology,Thomas J. Silhavy,microbiology,1916-01-01
