col0,col1,col2,col3
LFH player ID,LNH player ID,Ligue Féminine de Handball,Wikidata property for an identifier that suggests notability
Women's Collegiate Tennis Hall of Fame ID,Tennis Hall of Fame player ID,Women's Collegiate Tennis Hall of Fame,Wikidata property related to college sports
LFH player ID,LNH player ID,Ligue Féminine de Handball,Wikidata property related to handball
Women's Basketball Hall of Fame ID,WNBA player ID,Women's Basketball Hall of Fame,Wikidata property related to a sports hall of fame
Women's Collegiate Tennis Hall of Fame ID,Tennis Hall of Fame player ID,Women's Collegiate Tennis Hall of Fame,Wikidata property related to a sports hall of fame
