col0,col1,col2,col3
Pygmalion and Galatea,silent film,France,Pygmalion
Hamlet,drama film,France,Hamlet
Oliver Twist,drama film,United States of America,Oliver Twist
The Devil's Foot,crime film,United Kingdom,The Adventure of the Devil's Foot
The Dying Detective,crime film,United Kingdom,The Adventure of the Dying Detective
The Octoroon,silent film,United States of America,The Octoroon
"Conn, the Shaughraun",silent film,Australia,The Shaughraun
Little Dorrit,silent film,United States of America,Little Dorrit
