col0,col1,col2,col3,col4
Vandenberg AFB Space Launch Complex 10,United States of America,military facility,Santa Barbara County,United States Air Force
RAAF Woomera Range Complex,Australia,Military exclusion zone,South Australia,Royal Australian Air Force
Cape Canaveral Air Force Station,United States of America,historic district,Brevard County,Air Force Space Command
White Sands Missile Range,United States of America,bombing range,New Mexico,United States Army
RAAF Woomera Range Complex,Australia,proving ground,South Australia,Royal Australian Air Force
Centro de Experimentación y Lanzamiento de Proyectiles Autopropulsados Mar Chiquita,Argentina,proving ground,Province of Buenos Aires,Argentine Air Force
San Nicolas Island,United States of America,proving ground,Ventura County,United States Navy
