col0,col1,col2,col3
Akita,Akita Prefecture,Akigin Stadium,306178
Mito,Ibaraki Prefecture,K's denki Stadium Mito,268750
Nagoya,Aichi Prefecture,Mizuho Park,2325918
Nagano,Nagano Prefecture,Minami Nagano Sports Park Stadium,370057
Kumamoto,Kumamoto Prefecture,Suizenji Stadium,739393
Yamagata,Yamagata Prefecture,Yamagata City Athletic Stadium,249327
Tottori,Tottori Prefecture,Tottori Bank Bird Stadium,188740
Sendai,Miyagi Prefecture,Sendai City Athletic Stadium,1058070
Sapporo,Hokkaidō,Sapporo Atsubetsu Park Stadium,1958756
