col0,col1,col2,col3,col4
A Christmas Album,Christian music,Ageless Medley,Straight Ahead,A Christmas Album
A Christmas Album,Christmas music,"Lifted or The Story is in the Soil, Keep Your Ear to the Ground","I'm Wide Awake, It's Morning",A Christmas Album
The Christmas Album,country music,Hat Town,Rules of the Road,The Christmas Album
The Christmas Album,Christmas music,The Essential Human Nature,Jukebox,The Christmas Album
The Christmas Album,pop music,How Can I Unlove You,The World of Lynn Anderson,The Christmas Album
The Christmas Album,rhythm and blues,Roberta,Holiday,The Christmas Album
The Christmas Album,country music,Acoustic,Bang Bang Bang,The Christmas Album
The Christmas Album,jazz,The Offbeat of Avenues,Anthology: Down in Birdland,The Christmas Album
