col0,col1,col2,col3,col4,col5
Cambodia,Prime Minister of Cambodia,outline of Cambodia,2.635,Khmer people,King of Cambodia
Papua New Guinea,Prime Minister of Papua New Guinea,outline of Papua New Guinea,3.757,Papuan people,monarch of Papua New Guinea
Andorra,Prime Minister of Andorra,outline of Andorra,1.27,French people,Episcopal Co-Prince
New Zealand,Prime Minister of New Zealand,outline of New Zealand,1.92,Pacific Islander,Monarch of New Zealand
Australia,Prime Minister of Australia,outline of Australia,1.859,English people,Monarch of Australia
Uzbekistan,Prime Minister of Uzbekistan,outline of Uzbekistan,2.2,Tatars,President of Uzbekistan
Armenia,Prime Minister of Armenia,outline of Armenia,1.531,Armenians,President of Armenia
Algeria,Prime Minister of Algeria,outline of Algeria,2.857,Europeans,President of Algeria
