col0,col1,col2,col3
Austin Hall and terrace complex,building complex,listed on the Victorian Heritage Register,South Geelong
Watson's Butchery,row house,Heritage Act - State Heritage Register,The Rocks
Avery Terrace,row house,Heritage Act - State Heritage Register,The Rocks
18 Crown Point Road,row house,Grade II listed building,Hunslet
Austin Hall and terrace complex,row house,listed on the Victorian Heritage Register,South Geelong
Royal Terrace,row house,listed on the Victorian Heritage Register,Fitzroy
