col0,col1,col2,col3
Archer,English,list of Archer characters,list of Archer episodes
Noein,Japanese,list of Noein characters,list of Noein episodes
The Legend of Korra,English,List of the Legend of Korra characters,list of The Legend of Korra episodes
King of the Hill,English,list of King of the Hill characters,list of King of the Hill episodes
American Dragon: Jake Long,American English,List of American dragon: Jake Long characters,list of American Dragon: Jake Long episodes
Ben 10: Alien Force,English,list of Ben 10 Alien Force characters,list of Ben 10: Alien Force episodes
VeggieTales,English,list of VeggieTales characters,list of VeggieTales episodes
The Ren & Stimpy Show,English,list of The Ren & Stimpy Show characters,list of The Ren & Stimpy Show episodes
Beavis and Butt-head,English,list of minor characters in Beavis and Butt-head,list of Beavis and Butt-head episodes
Yin Yang Yo!,English,list of Yin Yang Yo! characters,list of Yin Yang Yo! episodes
The Spectacular Spider-Man,English,list of The Spectacular Spider-Man characters,list of The Spectacular Spider-Man episodes
BoJack Horseman,English,list of BoJack Horseman characters,list of BoJack Horseman episodes
