col0,col1,col2,col3,col4,col5
The Video Game Media Assets Collection,Video Game Media Assets Collection,blog post,Frank Cifaldi,English,The Video Game Media Assets Collection
Why is today “National Video Games Day”?,National Video Games Day,blog post,Frank Cifaldi,English,Why is today “National Video Games Day”?
Every English-Language Video Game Magazine Still In Print,video game magazine,blog post,Frank Cifaldi,English,Every English-Language Video Game Magazine Still In Print
Classification Board Responds To Senator's Call To Ban Anime,anime,news article,Alex Walker,English,Classification Board Responds To Senator's Call To Ban Anime
Rape Day will not ship on Steam,video game controversies,blog post,Valve Corporation,English,Rape Day will not ship on Steam
"Wikimedia Foundation Board on healthy Wikimedia community culture, inclusivity, and safe spaces",Wikimedia Foundation,blog post,María Sefidari,English,"Wikimedia Foundation Board on healthy Wikimedia community culture, inclusivity, and safe spaces"
Meet the Jon Jones Who Keeps Getting Nasty Tweets Meant for the Other Jon Jones,Jon Jones,blog post,Josh Rosenblatt,English,Meet the Jon Jones Who Keeps Getting Nasty Tweets Meant for the Other Jon Jones
