col0,col1,col2,col3,col4,col5,col6
Snake ring-E 27192,-0100-01-01T00:00:00Z,Department of Egyptian Antiquities of the Louvre,archaeological artifact,snake,gold,Room 320
Ring-Seal dedicated to God Khonsu-Neferhotep-AF 12841,-0999-01-01T00:00:00Z,Department of Egyptian Antiquities of the Louvre,archaeological artifact,𓏙,faience,"Room 643, display case 5"
ring-seal ornated with two Egyptian-style sphinx,-2000-01-01T00:00:00Z,Department of Near Eastern Antiquities of the Louvre,archaeological artifact,sphinx,gold,"Room 300, display case 7"
ring ornated with two Egyptian-style cats and a sistrum,-2000-01-01T00:00:00Z,Department of Near Eastern Antiquities of the Louvre,archaeological artifact,Bastet,gold,"Room 300, display case 7"
Ring with Ducks-E 11607,-1200-01-01T00:00:00Z,Department of Egyptian Antiquities of the Louvre,archaeological artifact,duck,gold,"Room 641, display case 5"
