col0,col1,col2,col3
Manchester,metropolitan borough,Greater Manchester,council of Manchester City Council
City of Newcastle upon Tyne,metropolitan borough,Tyne and Wear,council of Newcastle City Council
Birmingham,metropolitan borough,West Midlands,council of Birmingham City Council
Coventry,metropolitan borough,West Midlands,council of Coventry City Council
Sheffield,metropolitan borough,South Yorkshire,council of Sheffield City Council
Wirral,metropolitan borough,Merseyside,Wirral Council
Bradford,metropolitan borough,West Yorkshire,council of Bradford City Council
Solihull,metropolitan borough,West Midlands,Solihull Metropolitan Borough Council
