col0,col1,col2,col3,col4,col5,col6
São Tomé and Príncipe,Africa,"Unity, Discipline, Labour",Pico de São Tomé,58950229,UTC±00:00,4.576
Barbados,North America,Pride and Industry,Mount Hillaby,431758132,UTC−04:00,1.794
Saint Lucia,North America,"The Land, The People, The Light",Mount Gimie,321767417,UTC−04:00,1.89
Antigua and Barbuda,North America,"Each Endeavouring, All Achieving",Mount Obama,313645370,UTC−04:00,2.075
Dominica,North America,After God is the earth,Morne Diablotins,212292574,UTC−04:00,1.9
