col0,col1,col2,col3,col4
Egmont Key State Park,place listed on the National Register of Historic Places,National Wildlife Refuge,1974-01-01,Florida
San Marcos de Apalache Historic State Park,National Historic Landmark,historic site,1966-01-01,Wakulla County
Crystal River Archaeological State Park,National Historic Landmark,tumulus,1970-01-01,Citrus County
Fort Zachary Taylor Historic State Park,National Historic Landmark,National Historic Landmark,1845-01-01,Monroe County
Yellow Bluff Fort Historic State Park,place listed on the National Register of Historic Places,Florida state park,1970-01-01,Florida
Washington Oaks State Gardens,place listed on the National Register of Historic Places,Florida state park,1964-01-01,Florida
