col0,col1,col2,col3,col4,col5
Katsina State,state of Nigeria,Kaduna State,1987-09-23,Governor of Katsina State,Katsina State House of Assembly
Ekiti State,state of Nigeria,Ondo State,1996-10-01,Governor of Ekiti State,Ekiti State House of Assembly
Bayelsa State,state of Nigeria,Rivers State,1996-10-01,Governor of Bayelsa State,Bayelsa State House of Assembly
Ebonyi State,state of Nigeria,Abia State,1996-10-01,Governor of Ebonyi State,Ebonyi State House of Assembly
Sokoto State,state of Nigeria,North-Western State,1976-02-03,Governor of Sokoto State,Sokoto State House of Assembly
Bauchi State,state of Nigeria,North-Eastern State,1976-02-03,Governor of Bauchi State,Bauchi State House of Assembly
Niger State,state of Nigeria,North-Western State,1976-02-03,Governor of Niger State,Niger State House of Assembly
Plateau State,state of Nigeria,Benue-Plateau State,1976-02-03,Governor of Plateau State,Plateau State House of Assembly
