col0,col1,col2,col3,col4,col5,col6,col7
Historical Reflections,Historical Reflections,history journal,history,Berghahn Books,Canada,1974-01-01,French
The Medieval Review,The Medieval Review,history journal,history,Indiana University,United States of America,1993-01-01,English
Journal of the History of Medicine and Allied Sciences,Journal of the History of Medicine and Allied Sciences,history journal,history of medicine,Oxford University Press,United States of America,1946-01-01,English
Early American Studies,Early American Studies,history journal,history of the United States,University of Pennsylvania Press,United States of America,2003-01-01,English
Journal of Scottish Historical Studies,Journal of Scottish Historical Studies,history journal,history of Scotland,Edinburgh University Press,Scotland,1980-01-01,English
European Review of Economic History,European Review of Economic History,history journal,economic history,Cambridge University Press,United Kingdom,1997-01-01,English
