col0,col1,col2,col3,col4,col5,col6
Scale model of Royal Louis-MnM 13 MG 32,520,Section Vaisseaux et modèles,France,452,"1/18 scale model of a three-decker of the mid-18th Century, possibly the [[:en:French ship Royal Louis (1758)|''Royal Louis'']] (1758)",1800-01-01
Scale model of Protée-MnM 13 MG 8,259,Section Vaisseaux et modèles,France,220,1/28th-scale model of the [[:en:French ship Protecteur|''Protecteur'']],1770-01-01
Scale model of Triomphant-MnM 17 MG 2,184,Section Vaisseaux et modèles,France,145,1/48 scale model of the 74-gun ship [[:en:French ship Le Triomphant (1804)|''Triomphant'']],1812-01-01
Scale model of Océan-MnM 13 MG 20,212,Section Vaisseaux et modèles,France,158,1/48th-scale model of the [[:en:French ship Océan (1790)|''Océan'']] in her 1807 state.,1794-01-01
Scale model of Flore-MnM 17 MG 10,171,Section Vaisseaux et modèles,France,124,"1/48th scale model of [[:en:French frigate Flore (1806)|''Flore'']] (1806), a frigate bearing 44 18-pounders",1900-01-01
Scale model of Louis Le Grand-MnM 13 MG 33,510,Section Vaisseaux et modèles,France,452,Model of the frigate-ship ''Louis le Grand'',1700-01-01
Scale model of a 16th century ship-MnM 5 MG 2,67,Section Navigation et Voyages,France,58,Scale model of a 16th century ship,1857-01-01
