col0,col1,col2,col3,col4
Vice-Admiral of the White,Royal Navy,admiral,military rank,Vice-Admiral of the Blue
Vice-Admiral of the Red,Royal Navy,admiral,military rank,Vice-Admiral of the White
Rear-Admiral of the Red,Royal Navy,admiral,military rank,Rear-Admiral of the White
Admiral of the Red,Royal Navy,admiral,military rank,Admiral of the White
second lieutenant,Canadian Armed Forces ranks,second lieutenant,military rank,officer cadet
brigadier general,Canadian Armed Forces ranks,brigader general,military rank,colonel
