col0,col1,col2,col3,col4
The Swamp of No Return,comic story,United States of America,1965-01-01,Uncle Scrooge
The Victory Garden,comic story,United States of America,1943-01-01,Walt Disney's Comics and Stories
The Sharpie of the Culebra Cut,comic story,United States of America,2001-01-01,Picsou Magazine
The Money Champ,comic story,United States of America,1959-01-01,Uncle Scrooge
The Golden River,comic story,United States of America,1958-01-01,Uncle Scrooge
The Fabulous Philosopher's Stone,comic story,United States of America,1955-01-01,Uncle Scrooge
