col0,col1,col2,col3
Igreja e Hospital da Santa Casa da Misericórdia de Elvas,"Ajuda, Salvador e Santo Ildefonso",Portugal,"Assunção, Ajuda, Salvador e Santo Ildefonso"
Roman Catholic Church in Seuca,Gănești,Romania,Mureș County
One Wood Church,Dezrobiți,Romania,Vâlcea County
"Archangels church in Berca, Buzău",Berca,Romania,Buzău County
Reformed and Roman-Catholic church in Micăsasa,Micăsasa,Romania,Sibiu County
"Lutheran church in Valea Viilor, Sibiu",Valea Viilor,Romania,Sibiu County
"Franciscan Church, Sibiu",Sibiu,Romania,Sibiu County
