col0,col1,col2,col3
Japan National Route 197,Japan National Route 441,Ehime Prefecture,Japan National Route 56
Japan National Route 57,Japan National Route 443,"Ministry of Land, Infrastructure, Transport and Tourism",Japan National Route 207
Japan National Route 42,Japan National Route 422,Aichi Prefecture,Wakayama Prefectural Road Route 23
Japan National Route 389,Japan National Route 57,Kumamoto Prefecture,Japan National Route 251
Japan National Route 280,roadside station in Japan,Aomori Prefecture,Japan National Route 227
Japan National Route 28,Japan National Route 318,Tokushima Prefecture,Japan National Route 2
Japan National Route 389,roadside station in Japan,Kagoshima Prefecture,Japan National Route 266
Mie Prefectural Road Route 47,Pearl Road,Mie Prefecture,Mie Prefectural Road Route 750
Japan National Route 389,roadside station in Japan,Kagoshima Prefecture,Japan National Route 501
