col0,col1,col2,col3,col4
Carnival of Alsasua – Altsasu,Navarre,Spain,Festival of Tourist Interest of Navarre,Alsasua – Altsasu
Carnival in La Roda,Albacete Province,Spain,Festival of Regional Tourist Interest in Castile-La Mancha,La Roda
Carnival of Miguelturra,Ciudad Real Province,Spain,Festival of Regional Tourist Interest in Castile-La Mancha,Miguelturra
Carnival of Almaden,Ciudad Real Province,Spain,Festival of Regional Tourist Interest in Castile-La Mancha,Almadén
Carnival of Alhama de Granada,Granada Province,Spain,Festival of Tourist Interest of Andalusia,Alhama de Granada
Zafarronada de Omaña,León Province,Spain,festival,Riello
