col0,col1,col2,col3,col4
Oastler Lake Provincial Park,Parry Sound District,Parry Sound,Georgian Bay Littoral,provincial park of Canada
Short Hills Provincial Park,Regional Municipality of Niagara,St. Catharines,Niagara Escarpment Biosphere Reserve,provincial park of Canada
The Massasauga Provincial Park,Parry Sound District,Parry Sound,Georgian Bay Littoral,provincial park of Canada
Killbear Provincial Park,Parry Sound District,Parry Sound,Georgian Bay Littoral,provincial park of Canada
Kakwa Wildland Provincial Park,Greenview No. 16,Grande Cache,Kakwa-Wilmore Interprovincial Park,provincial park of Canada
Woodland Caribou Provincial Park,Unorganized Kenora District,Red Lake,Pimachiowin Aki,provincial park of Canada
Willmore Wilderness Park,Improvement District No. 25,Grande Cache,Kakwa-Wilmore Interprovincial Park,provincial park of Canada
Lion's Head Provincial Park,Bruce County,"Lion's Head, Ontario",Niagara Escarpment Biosphere Reserve,provincial park of Canada
Nairn Falls Provincial Park,Squamish-Lillooet Regional District,Pemberton,Green River,provincial park of Canada
Lake Superior Provincial Park,Algoma District,Wawa,Northern Ontario,provincial park of Canada
Mono Cliffs Provincial Park,Dufferin County,Mono,Niagara Escarpment Biosphere Reserve,provincial park of Canada
