col0,col1,col2,col3,col4,col5,col6
Larpool Viaduct,River Esk,Scarborough,United Kingdom,Grade II listed building,railway viaduct,13
Laigh Milton Viaduct,River Irvine,South Ayrshire,United Kingdom,category A listed building,railway viaduct,4
Ballochmyle Viaduct,River Ayr,East Ayrshire,United Kingdom,category A listed building,railway viaduct,7
Viaduc de la Bouble,Bouble,Louroux-de-Bouble,France,registered historic monument,railway viaduct,6
Altenbeken Viaduct,Beke,Altenbeken,Germany,architectural heritage monument in North Rhine-Westphalia,railway viaduct,24
Larpool Viaduct,River Esk,Scarborough,United Kingdom,Grade II listed building,deck arch bridge,13
Redbridge Viaduct,River Tweed,Scottish Borders,United Kingdom,category B listed building,stone bridge,5
Woodroad Viaduct,Lugar Water,East Ayrshire,United Kingdom,category A listed building,stone bridge,13
