col0,col1,col2,col3,col4,col5
Arbat,"Cultural heritage monuments in Arbat, Ararat",village in Armenia,Armenian,391,Armenian oblast
Gladzor,"Cultural heritage monuments in Gladzor, Vayots Dzor",village in Armenia,Armenian,128,Vayots Dzor Region
Getap,"Cultural heritage monuments in Getap, Vayots Dzor",village in Armenia,Armenian,201,Vayots Dzor Region
Chiva,"Cultural heritage monuments in Chiva, Vayots Dzor",village in Armenia,Armenian,52,Vayots Dzor Region
Gndevaz,"Cultural heritage monuments in Gndevaz, Vayots Dzor",village in Armenia,Armenian,303,Vayots Dzor Region
Bardzruni,"Cultural heritage monuments in Bardzruni, Vayots Dzor",village in Armenia,Armenian,397,Vayots Dzor Region
Haghartsin,"Cultural heritage monuments in Haghartsin, Tavush",village in Armenia,Armenian,4022,Tavush Region
