col0,col1,col2,col3
SS Jalabala,cargo ship,The Scindia Steam Navigation Company Ltd.,British Raj
USNS Yuma,cargo ship,Military Sealift Command,United States of America
MV Maersk Tigris,cargo ship,Maersk Line,Singapore
USS Pensacola,cargo ship,United States Navy,German Empire
HMS Lothian,cargo ship,Royal Navy,United Kingdom
Ulysse,cargo ship,Compagnie Tunisienne de Navigation,Tunisia
USS Kermoor,steamship,United States Navy,United States of America
USS Camden,submarine tender,United States Navy,United States of America
