col0,col1,col2,col3,col4
Villa Fiorita metro station,Cernusco sul Naviglio,2,Mi4,Cernusco sul Naviglio metro station
Cascina Burrona metro station,Vimodrone,2,Mi3,Cernusco sul Naviglio metro station
Gessate metro station,Gessate,2,Mi6,Cascina Antonietta metro station
Gorgonzola metro station,Gorgonzola,2,Mi5,Cascina Antonietta metro station
Fawdon metro station,Fawdon,2,Tyne and Wear Metro fare zone B,Kingston Park metro station
Kingston Park metro station,City of Newcastle upon Tyne,2,Tyne and Wear Metro fare zone B,Fawdon metro station
Cascina Gobba metro station,Milan,5,Mi1,Vimodrone metro station
Cascina Burrona metro station,Vimodrone,2,Mi3,Vimodrone metro station
Cascina Gobba metro station,Milan,5,Mi3,Vimodrone metro station
