col0,col1,col2,col3
Revue Française de Civilisation Britannique,OpenEdition Journals,open-access journal,Lucienne Germain
Les Dossiers du Grihl,OpenEdition Journals,open-access journal,Grihl
Itinéraires,OpenEdition Journals,academic journal,Paris 13 University
Revue Française de Civilisation Britannique,OpenEdition Journals,academic journal,Lucienne Germain
Les Dossiers du Grihl,OpenEdition Journals,magazine,Grihl
ZooKeys,ARPHA publishing platform,academic journal,Terry Erwin
Canadian Journal of Bioethics,Open Journal Systems,academic journal,Bryn Williams-Jones
Eco.mont – Journal on Protected Mountain Areas Research and Management,Open Journal Systems,scientific journal,Axel Borsdorf
