col0,col1,col2,col3
Battle Ground Lake State Park,Washington state park,1966-01-01,Washington
Alta Lake State Park,Washington state park,1951-01-01,Washington
Rockport State Park,Washington state park,1961-01-01,Washington
Rainbow Falls State Park,Washington state park,1935-01-01,Washington
Palouse Falls State Park,Washington state park,1951-01-01,Washington
Larrabee State Park,Washington state park,1915-01-01,Washington
Fort Ebey State Park,Washington state park,1981-01-01,Washington
Goldendale Observatory State Park,Washington state park,1981-01-01,Washington
Crawford State Park,Washington state park,1921-01-01,Washington
