col0,col1,col2,col3,col4,col5,col6
Monforte Altarpiece,1470-01-01,242,Room V,public domain,oak,Gemäldegalerie
Mary with the Child,1487-01-01,31.5,Gemäldegalerie,public domain,oak,Gemäldegalerie
Rest on the Flight to Egypt,1520-01-01,78,Gemäldegalerie,public domain,oak,Gemäldegalerie
Mary Enthroned with the Child,1485-01-01,46.5,Gemäldegalerie,public domain,oak,Gemäldegalerie
A Game of Chess,1508-01-01,36,Gemäldegalerie,public domain,oak,Gemäldegalerie
Portrait of a Woman,1440-01-01,32.9,Gemäldegalerie,public domain,oak,Gemäldegalerie
St. John the Evangelist on Patmos,1489-01-01,43.3,Gemäldegalerie,public domain,oak,Gemäldegalerie
Christ in the House of Simon,1440-01-01,61,Gemäldegalerie,public domain,oak,Gemäldegalerie
Mary with the Child,1487-01-01,31.5,Berlin,public domain,oak,Gemäldegalerie
