col0,col1,col2,col3,col4,col5,col6
Morrongo,Mediterranean Sea,golden sand beach,Blue Flag beach,240,Benicarló,25
Platja Port d’es Torrent,Mediterranean Sea,golden sand beach,Blue Flag beach,110,Sant Josep de sa Talaia,60
"Playa de la Concha, Oropesa",Mediterranean Sea,golden sand beach,Blue Flag beach,850,Castellón Province,60
Cala Benirràs,Mediterranean Sea,golden sand beach,Blue Flag beach,150,Sant Joan de Labritja,40
Port de Sagunt,Mediterranean Sea,golden sand beach,Blue Flag beach,2100,Sagunto,90
Llevant,Mediterranean Sea,golden sand beach,Blue Flag beach,375,Diagonal Mar i el Front Marítim del Poblenou,59
Els Muntanyans,Mediterranean Sea,golden sand beach,Blue Flag beach,2160,Torredembarra,30
Platja de la Mar Menuda,Mediterranean Sea,urban beach,Blue Flag beach,180,Tossa de Mar,20
