col0,col1,col2,col3
Gondemaria e Olival,2013-01-28,Ourém,Matas e Cercal
Sabugal e Aldeia de Santo António,2013-01-28,Sabugal,Santo Estêvão e Moita
Gondemaria e Olival,2013-01-28,Ourém,Santa Catarina da Serra e Chainça
"Coz, Alpedriz e Montes",2013-01-28,Alcobaça,Pataias e Martingança
Cadaval e Pêro Moniz,2013-01-28,Cadaval,Bombarral e Vale Covo
Cascais e Estoril,2013-01-28,Cascais,Carcavelos e Parede
Cadaval e Pêro Moniz,2013-01-28,Cadaval,Campelos e Outeiro da Cabeça
Miragaia e Marteleira,2013-01-28,Lourinhã,Campelos e Outeiro da Cabeça
Lourinhã e Atalaia,2013-01-28,Lourinhã,União das Freguesias de São Bartolomeu dos Galegos e Moledo
