col0,col1,col2,col3,col4,col5,col6
Biology and therapy of fibromyalgia. Genetic aspects of fibromyalgia syndrome,review article,English,"A randomized, double-blind, placebo-controlled trial of pramipexole, a dopamine agonist, in patients with fibromyalgia receiving concomitant medications",Arthritis Research and Therapy,fibromyalgia,2006-01-01
Modulation of tumor necrosis factor by microbial pathogens.,review article,English,Myxoma virus M11L prevents apoptosis through constitutive interaction with Bak.,PLOS Pathogens,bacteria,2006-02-01
Science review: Vasopressin and the cardiovascular system part 1--receptor physiology,review article,English,Vasopressin receptors.,Critical Care,membrane proteins,2003-12-01
Systematic review and meta-analysis of randomised trials and cohort studies of mycophenolate mofetil in lupus nephritis,review article,English,Why most published research findings are false,Arthritis Research and Therapy,lipid,2006-01-01
Modulation of tumor necrosis factor by microbial pathogens.,scientific article,English,Mechanism of rLcrV and rYopB mediated Immunosuppression in murine peritoneal macrophages.,PLOS Pathogens,eukaryote,2006-02-01
Early onset torsion dystonia,review article,English,"Dystonia musculorum deformans. Clinical, genetic and pathoanatomical studies.",Orphanet Journal of Rare Diseases,generalized dystonia,2006-11-27
