col0,col1,col2,col3
The Bodyguard -  Original Soundtrack Album,Original Soundtrack Album,I Will Always Love You,The Bodyguard
Glory Daze Original Motion –  Picture Soundtrack,Original Motion Picture Soundtrack,Even Hitler Had a Girlfriend,Glory Daze
Reality Bites – Original Motion Picture Soundtrack,Original Motion Picture Soundtrack,All I Want Is You,Reality Bites
Cocktail – Original Motion Picture Soundtrack,Original Motion Picture Soundtrack,Tutti Frutti,Cocktail
Buffy the Vampire Slayer – Original Motion Picture Soundtrack,Original Motion Picture Soundtrack,I Ain't Gonna Eat Out My Heart Anymore,Buffy the Vampire Slayer
Guardians of the Galaxy: Awesome Mix Vol. 1 – Original Motion Picture Soundtrack,Original Motion Picture Soundtrack,Moonage Daydream,Guardians of the Galaxy: Awesome Mix Vol. 1
