col0,col1,col2,col3,col4
"Vista Panorâmica da Região do Hospital Candelária, entre Santo Antonio e Porto Velho - 739",Dana Merrill collection,photograph,Dana B. Merrill,GLAM Museu Paulista
"Vista Panorâmica da Região do Hospital Candelária, entre Santo Antonio e Porto Velho - 733",Dana Merrill collection,photograph,Dana B. Merrill,GLAM Museu Paulista
Aspecto Interno da Lavanderia a Vapor em Porto Velho - 537,Dana Merrill collection,photograph,Dana B. Merrill,GLAM Museu Paulista
Gerador de Energia Elétrica Movido a Óleo Cru. Porto Velho - 734,Dana Merrill collection,photograph,Dana B. Merrill,GLAM Museu Paulista
"Navio Cargueiro Holandês, S. S. Callisto, Atracado no Cais de Porto Velho - 737",Dana Merrill collection,photograph,Dana B. Merrill,GLAM Museu Paulista
Locomotiva Baldwin Deixada em Santo Antonio Pela Empresa P.& T. Collins em 1879 - 300,Dana Merrill collection,photograph,Dana B. Merrill,GLAM Museu Paulista
Vista Interna do Dispensário do Hospital Candelária - 752,Dana Merrill collection,photograph,Dana B. Merrill,GLAM Museu Paulista
Vista Parcial de Porto Velho,Dana Merrill collection,photograph,Dana B. Merrill,GLAM Museu Paulista
