col0,col1,col2,col3,col4
Jerry Before Seinfeld,Netflix,United States of America,Max Hardcore,mockumentary
"Knock Knock, It's Tig Notaro",Showtime Networks,United States of America,Adam Samuel Goldman,stand-up comedy
Stand-Up Confidential,HBO,United States of America,Kevin Kiner,stand-up comedy
Jerry Before Seinfeld,Netflix,United States of America,Max Hardcore,stand-up comedy
Rudolph's Shiny New Year,Warner Bros. Television,United States of America,Maury Laws,Christmas film
Kevin Hart: Laugh at My Pain,AMC Theatres,United States of America,Dylan Berry,stand-up comedy
I'm Telling You for the Last Time,HBO,United States of America,Michael Kamen,stand-up comedy
