col0,col1,col2,col3,col4
Somerton Castle,licence to crenellate,Boothby Graffoe,South-west outbuilding at Somerton Castle,1281-01-01
Wressle Castle,conflagration,Wressle,Bakehouse at Wressle Castle,1390-01-01
Farleigh Hungerford Castle,licence to crenellate,Mendip,"Chapel, Fairleigh Castle",1383-01-01
Beverston Castle,conflagration,Beverston,Gatehouse To Beverston Castle,1225-01-01
Somerton Castle,licence to crenellate,Boothby Graffoe,Orchard Outbuilding At Somerton Castle,1281-01-01
Cawood Castle,licence to crenellate,Selby,Cawood Castle Gatehouse,1378-01-01
