col0,col1,col2,col3,col4
Monument to Hodenhagen Castle,architectural heritage monument,memorial stone,Hodenhagen,Germany
"Wolfsberg, Judenstein",Denkmalgeschütztes Objekt,memorial stone,Wolfsberg,Austria
Israelitischer Friedhof Trautmanndorf,Denkmalgeschütztes Objekt,memorial stone,Bad Gleichenberg,Austria
Memorial Stone for Emperor Maximilian I,Denkmalgeschütztes Objekt,memorial stone,Hallstatt,Austria
Achterjäger-Gedenkstein im Achterjäger-Park Klagenfurt,Denkmalgeschütztes Objekt,memorial stone,Klagenfurt,Austria
The Stork Stone,protected ancient monument in Denmark,memorial stone,Tårnby Municipality,Denmark
Inscribed stone in St Mary's Churchyard,Grade II listed building,memorial stone,Pembrokeshire,United Kingdom
