col0,col1,col2,col3,col4
Whitefish Lake Provincial Park,Canada,24.808,provincial park of Manitoba,Manitoba
Burge Lake Provincial Park,Canada,6.12,provincial park of Manitoba,Manitoba
Duff Roblin Provincial Park,Canada,31.79,provincial park of Manitoba,Winnipeg
Netley Creek Provincial Park,Canada,1.524,provincial park of Manitoba,St. Andrews
Neso Lake Provincial Park,Canada,1.33,provincial park of Manitoba,Manitoba
Red Deer River Provincial Park,Canada,0.996,provincial park of Manitoba,Manitoba
Lockport Provincial Park,Canada,2.26,provincial park of Manitoba,Rural Municipality of St. Clements
Primrose Provincial Park,Canada,6.476,provincial park of Manitoba,Rural Municipality of Mountain
Seton Provincial Park,Canada,1.59,provincial park of Manitoba,Municipality of North Cypress – Langford
