col0,col1,col2,col3
Saint George and the Princess,Pellegrini chapel,Sant'Anastasia,Italy
Expulsion from the Garden of Eden,Brancacci Chapel,Santa Maria del Carmine,Italy
Isaac Rejecting Esau,Upper Basilica of San Francesco d'Assisi,Basilica of San Francesco d'Assisi,Italy
The Cup of Benjamin Stories,Upper Basilica of San Francesco d'Assisi,Basilica of San Francesco d'Assisi,Italy
Death of Abel,Upper Basilica of San Francesco d'Assisi,Basilica of San Francesco d'Assisi,Italy
Resurrection,Upper Basilica of San Francesco d'Assisi,Basilica of San Francesco d'Assisi,Italy
Ecce Homo,Santuario de Misericordia,Borja,Spain
