col0,col1,col2,col3
collar of the St. Sebastian Guild from Keerbergen,Halle Gate,gold leaf,gilding
collar of the St. Sebastian Guild from Machelen,Halle Gate,gold leaf,gilding
collar of an archers guild from Mechelen,Halle Gate,gold leaf,gilding
collar of a guild of musketeers,Halle Gate,gold leaf,gilding
collar of an archers guild,Halle Gate,silver,gilding
collar of the guild of musketeers from Nivelles,Halle Gate,silver,gilding
collar of the St. Sebastian Guild from Keerbergen,Halle Gate,silver,gilding
collar of an archers guild from Mechelen,Halle Gate,silver,gilding
collar of a guild of musketeers,Halle Gate,silver,gilding
