col0,col1,col2,col3,col4,col5
Edward Hopper,Edward Hopper,Edward Hopper,Lloyd Goodrich,exhibition catalogue,Whitney Museum of American Art
Contemporary Negro Art,Contemporary Negro Art,Contemporary Negro Art,Alain LeRoy Locke,exhibition catalogue,Baltimore Museum of Art
de Kooning: A Retrospective,de Kooning: A Retrospective,de Kooning: A Retrospective,John Elderfield,exhibition catalogue,Museum of Modern Art
Christoffer Wilhelm Eckersberg,Christoffer Wilhelm Eckersberg,Christoffer Wilhelm Eckersberg,Kasper Monrad,exhibition catalogue,Statens Museum for Kunst
Jacob van Ruisdael exhibition 2005-2006,Jacob van Ruisdael,Jacob van Ruisdael,Seymour Slive,art catalog,Yale University Press
Jacob van Ruisdael exhibition 1981-1982,Jacob van Ruisdael,Jacob van Ruisdael,Seymour Slive,art catalog,Mauritshuis
