col0,col1,col2,col3,col4
Saint-Adelphe,Mékinac Regional County Municipality,139,1891-10-19,Saint-Ubalde
Lac-aux-Sables,Mékinac Regional County Municipality,286.2,1899-04-24,Saint-Ubalde
La Doré,Le Domaine-du-Roy Regional County Municipality,297.1,1906-03-16,Saint-Thomas-Didyme
Saint-Alexandre-des-Lacs,La Matapédia Regional County Municipality,90.8,1965-01-01,Saint-Tharcisius
Saint-Adelphe,Mékinac Regional County Municipality,139,1891-10-19,Saint-Séverin
Sacré-Cœur-de-Jésus,Les Appalaches Regional County Municipality,104.4,1902-12-05,Saint-Séverin
