col0,col1,col2,col3
Stroud Spiritualist Church,Grade II listed building,United Kingdom,grammar school
Former Leeds Central High School,Grade II listed building,United Kingdom,secondary school
Stroud Spiritualist Church,Grade II listed building,United Kingdom,public library
Collège du Mont-Saint-Louis,classified heritage immovable,Canada,low-income housing
"Church Hall, Formerly Sunday School",Grade II listed building,United Kingdom,church hall
Collège du Mont-Saint-Louis,classified heritage immovable,Canada,educational institution
