col0,col1,col2,col3,col4,col5
FFF character ID,Diabolik,FFF author ID,Wikidata property related to fictional characters,single value constraint,Fondazione Franco Fossati
AnimeClick manga ID,One Piece,AnimeClick anime ID,Wikidata property related to comics,single value constraint,AnimeClick
FFF character ID,Diabolik,FFF author ID,Wikidata property related to comics,single value constraint,Fondazione Franco Fossati
FFF author ID,René Goscinny,Guida al Fumetto Italiano ID,Wikidata property related to comics,single value constraint,Fondazione Franco Fossati
AnimeClick manga ID,One Piece,AnimeClick anime ID,Wikidata property for authority control for works,single value constraint,AnimeClick
FFF author ID,Claire Bretécher,Guida al Fumetto Italiano ID,Wikidata property for authority control for people,single value constraint,Fondazione Franco Fossati
