col0,col1,col2,col3,col4
Maria column in Hostěradice,Czech Republic,Hostěradice,cultural monument of the Czech Republic,Maria column
Maria column in Horní Jelení,Czech Republic,Horní Jelení,cultural monument of the Czech Republic,Maria column
"Maria column, Rotenturm an der Pinka",Austria,Rotenturm an der Pinka,Denkmalgeschütztes Objekt,Maria column
"Mariensäule, Jodok-Fink-Platz",Austria,Josefstadt,Denkmalgeschütztes Objekt,Maria column
Mariensäule mit Maria Immaculata Ybbs an der Donau,Austria,Ybbs an der Donau,Denkmalgeschütztes Objekt,Maria column
Maria column in Samšina,Czech Republic,Samšina,cultural monument of the Czech Republic,Maria column
