col0,col1,col2,col3,col4,col5
Ravensburg,1276-01-01,Stadtarchiv Ravensburg,urban municipality of Germany,Landkreis Ravensburg,92.05
Offenburg,1148-01-01,Stadtarchiv Offenburg,urban municipality of Germany,Ortenau,78.38
Plauen,1112-01-01,Stadtarchiv Plauen,urban municipality of Germany,Vogtlandkreis,102.11
Offenburg,1148-01-01,Stadtarchiv Offenburg,former administrative territorial entity,Ortenau,78.38
Ravensburg,1276-01-01,Stadtarchiv Ravensburg,city with tens of thousands of inhabitants,Landkreis Ravensburg,92.05
Marienberg,1521-01-01,Stadtarchiv Marienberg,mining community,Erzgebirgskreis,25.306
Freiberg,1186-01-01,municipal archive Freiberg,mining community,Mittelsachsen,48.32
Marienberg,1521-01-01,Stadtarchiv Marienberg,big district town,Erzgebirgskreis,25.306
Weißenburg in Bayern,1296-01-01,Stadtarchiv Weißenburg i. Bay.,big district town,Weißenburg-Gunzenhausen,97.55
